date,description,repository,accession,url,doi
2018-02-02,Quantitative genetic analysis of the maize phyllosphere,NCBI,PRJNA432663,https://www.ncbi.nlm.nih.gov/bioproject/PRJNA432663,
2019-09-25,DNA and RNA sequencing of Utricularia gibba to find novel regulatory elements,NCBI,PRJNA574143 & PRJNA595351,https://www.ncbi.nlm.nih.gov/bioproject/?term=PRJNA595351,
2020-07-17,Comparison of DNA Extraction and Amplification methods for Plant-Associated Samples,NCBI,PRJNA646931,https://www.ncbi.nlm.nih.gov/bioproject/PRJNA646931,
2021-03-08,Genetic Diversity of 22 Commerical Hemp Accessions,NCBI,PRJNA707556,https://www.ncbi.nlm.nih.gov/bioproject/PRJNA707556,
2021-11-07,16s rRNA sequencing of the maize microbiome across Georgia,NCBI,PRJNA778544,https://www.ncbi.nlm.nih.gov/bioproject/PRJNA778544,
2022-09-06,Timecourse of tall fescue and epichloe endophyte under heat stress (preliminary experiment),NCBI,PRJNA877271,https://www.ncbi.nlm.nih.gov/bioproject/PRJNA877271,
2023-07-12,RNAseq timecourse of developing Tall Fescue ovaries +/- Epichloe endophytes,NCBI,PRJNA994000,http://www.ncbi.nlm.nih.gov/bioproject/994000,
