period,date,authors,title,event,location,international
Assistant Professor,2015-03-01,"Wallace, J. G., Beyene, Y., Semagn, K., Zhang, X., & Buckler, E. S.",Combined mapping of height and flowering time across 15 biparental populations using both traditional and Bayesian association mapping,57th Annual Maize Genetics Conference,"St. Charles, Illinois",TRUE
Assistant Professor,2016-11-01,"Wallace, J. G., Kremling, K. A., Chen, S. Y., Su, M. H., Pardo, J., Lepak, N. K., Budka, J. S., Buckler, E. S.",The Effect of Host Genetics on the Maize Leaf Microbiome across 270 Diverse Inbred Lines,Phytobiomes: From Microbes to Plant Ecosystems,"Santa Fe, New Mexico",TRUE
Assistant Professor,2017-01-10,"Wallace, J. G., Kremling, K. A., Chen, S. Y., Su, M. H., Pardo, J., Lepak, N. K., Budka, J. S., Buckler, E. S.",Analyzing the Leaf Microbiome across 270 Diverse Maize Lines,Plant and Animal Genome XXIV,"San Diego, California",TRUE
Assistant Professor,2017-03-10,"Wallace, J. G., Kremling, K. A., Chen, S. Y., Su, M. H., Pardo, J., Lepak, N. K., Budka, J. S., Buckler, E. S.",Quantitative Analysis of the Maize Leaf Microbiome,59th Annual Maize Genetics Conference,"St. Louis, Missouri",TRUE
Assistant Professor,2017-10-26,"Johnson, M., Rodriguez, D., Upadhyaya, H., Wallace, J.G.",First Population Genetic Analysis of Three Minor Millets,UGA Plant Center Retreat,"Helen, Georgia",
Assistant Professor,2018-03-22,"Wallace, J. G., Kremling, K. A., Chen, S. Y., Su, M. H., Pardo, J., Lepak, N. K., Budka, J. S., Buckler, E. S.",The Effect of Host and Environment on the Maize microbiome,60th Annual Maize Genetics Conference,"Saint-Malo, France",TRUE
Assistant Professor,2018-05-10,"Kovar, L., & Wallace, J. G.",Untangling bacterial interactions in the maize leaf microbiome - A co-abundance network approach,"UGA Institute of Plant Breeding, Genetics & Genomics annual retreat","Pine Mountain, Georgia",
Assistant Professor,2018-06-20,"Wallace, J. G., Kremling, K. A., Chen, S. Y., Su, M. H., Pardo, J., Lepak, N. K., Budka, J. S., Buckler, E. S.",The Effect of Host and Environment on the Maize microbiome,21st Annual Penn State Plant Biology Symposium: Wild and Tame Phytobiomes,"State College, Pennsylvania",
Assistant Professor,2018-09-06,"Wallace, J. G. and Young, C. A.",ECA-PGR: Identifying Host Factors that Influence the Association of Tall Fescue (Festuca arundinacea) with beneficial Epichloë endophytes,Plant Genome Research Program 21st Annual Awardee Meeting,"Washington, D.C.",
Assistant Professor,2018-09-06,"Parrott, W. A. and Wallace, J. G.",TRANSFORM-PGR: Mining the compact Utricularia genome as source of novel regulatory elements for crop biotechnology,Plant Genome Research Program 21st Annual Awardee Meeting,"Washington, D.C.",
Assistant Professor,2018-09-26,"Kovar, L., & Wallace, J. G.","Leaf microbiome community structure, co-abundance analysis, and correlation with phenotype across 270 diverse maize lines",UGA Plant Center Retreat,"Helen, Georgia",
Associate Professor,2019-03-15,"Kovar, L., Johnson, M. S., Griffis, H. K., & Wallace, J. G.",A survey of the maize-associated microbiota in georgia,62nd Annual Maize Genetics Conference,"Saint Louis, Missouri",TRUE
Assistant Professor,2019-05-13,"Johnson, M., Coolong, T., & Wallace, J. G.",Bringing Hemp to Georgia: A project to Develop Hemp Varieties for Georgia,"UGA Institute of Plant Breeding, Genetics & Genomics annual retreat","Amicalola Falls, Georgia",
Assistant Professor,2019-09-05,"Wallace, J. G. and Young, C. A.",We are using Tall Fescue to understand how plants work with beneficial microbes,Plant Genome Research Program 22nd Annual Awardee Meeting,"Washington, D.C.",
Assistant Professor,2019-09-05,"Parrott, W. A. and Wallace, J. G.",The small Bladderwort genome is a promising source of regulatory elements for genetic engineering,Plant Genome Research Program 22nd Annual Awardee Meeting,"Washington, D.C.",
Associate Professor,2020-01-12,"Wallace, J. G.",Livia: Teaching Evolution with Images,Plant & Animal Genome XXVIII,"San Diego, California",TRUE
Associate Professor,2020-08-12,"Flanagan, A., Lawrence, K., Wallace, J. G., Talbott, C., Poore, M., Hardin, F., & Young, C. A.",Empowering a strong STEM and agricultural workforce: Exploring the inconspicuous symbiotic relationship of fungal endophytes in grasses ,Plant Health 2020,Virtual,
Associate Professor,2021-03-03,"Schultz, C., Brantley, K., & Wallace, J. G.",Quantifying Maize Genotype by Endophyte Interaction,Microbiome for Agriculture Congress 2021,Virtual,
Associate Professor,2021-06-07,"Park, J., Kovar, L., LaFayette, P., Parrot, W., & Wallace, J. G.",Bladderwort Insulator Elements for Crop Biotechnology,In Vitro Biology Meeting 2021,Virtual,
Associate Professor,2021-07-21,"Diepenbrock, C., Ilut, D., Magallanes-Lundback, M., et. al.",Genetic basis of natural variation for carotenoid and tocochromanol levels in maize grain,Plant Biology 2021: ASPB 2021 Worldwide Summit,Virtual,
Associate Professor,2021-10-01,"Ane, J-M., Khokhani, D., Maeda, J., Mus, F., Infante, V., Calderon, C., Wallace, J. G., Vermerris, W., Voigt, C., Peters, J., Pankievicz, V. C. S.",Associative nitrogen-fixation for cereal crops: old challenges and new opportunities,14th European Nitrogen Fixation Conference ,Virtual,TRUE
Associate Professor,2021-11-10,"Punnuri, S., Ayele, A., Harris-Schultz, K., Knoll, J., Coffin, A., Tadesse, H., Armstrong, S., Li, H., & Wallace, J. G.",Understanding Genetic Diversity and Genome- Wide Association Mapping of Resistance to Sugarcane Aphid in Sorghum Bicolor,2021 ASA-CSSA-SSSA International Annual Meeting,"Salt Lake City, Utah",
Associate Professor,2022-03-02,"Li, Hanxia, & Wallace, J. G.","The effect of maize genotypes, environments, and GxE interactions on maize endophytes",64th Annual Maize Genetics Conference,"Saint Louis, Missouri",TRUE
Associate Professor,2022-03-02,"Schultz, C. & Wallace, J. G.",Maize genetic diversity and microbial interactions,64th Annual Maize Genetics Conference,"Saint Louis, Missouri",TRUE
Associate Professor,2022-03-02,"Wilker, J. L., Wallace, J. G., de Leon, N., Calderon, C., Ane, J-M.",Genetic control of maize aerial node root number and diameter,64th Annual Maize Genetics Conference,"Saint Louis, Missouri",TRUE
Associate Professor,2022-01-11,"Punnuri, S., Ayele, A., Harris-Schultz, K., Knoll, J., Coffin, A., Tadesse, H., Armstrong, S., Wiggins, T., Li, H., Sattler, S., & Wallace, J. G.",GWAS Analysis for Understanding Sugarcane Aphid Resistance in Sorghum,Plant & Animal Genome XXIX,Virtual,TRUE
Associate Professor,2022-01-11,"Corut, K., &  Wallace, J. G.",kGWASflow: A Snakemake Pipeline for k-Mers-Based GWAS and Its Application to Maize Leaf Microbiome Traits,Plant & Animal Genome XXIX,Virtual,TRUE
Associate Professor,2022-01-11,"Li, Hanxia, & Wallace, J. G.",Living Mulch Fosters a More Diverse and Balanced Bacterial Community in Corn Production,Plant & Animal Genome XXIX,Virtual,TRUE
Associate Professor,2022-01-11,"Schultz, C. & Wallace, J. G.",Maize Genetic Diversity and Microbial Interactions,Plant & Animal Genome XXIX,Virtual,TRUE
Associate Professor,2022-04-04,"Ayele, A., Punnuri, S., Wiggins, T., Harris-Schultz, K., Knoll, J., Coffin, A., Tadesse, H., Armstrong, S., Li, H., Sattler, S., & Wallace, J. G.",Genome-Wide Association Study detected potential markers and genes associated with sugarcane aphid resistance in sorghum bicolor. ,USDA ARD Research Symposium 2022,"Atlanta, Georgia",
Associate Professor,2022-04-15,"Punnuri, S., Ayele, A., Harris-Schultz, K., Knoll, J., Coffin, A., Tadesse, H., Li, H., & Wallace, J. G.",Assessing sugarcane aphid resistance in sorghum in relation to plant maturity and morphology,Georgia Entomological Society,"Jekyll Island, Georgia",
Associate Professor,2022-08-14,"Li, Hanxia, & Wallace, J. G.",Gene-by-environment Interaction is the Largest Effect on Maize Endophyte Variability,International Society for Microbial Ecology,"Lausanne, Switzerland",TRUE
Associate Professor,2022-09-09,"Talamantes, D., Corut, K., Nagabhyru, P., Schardl, C., & Wallace, J. G",We are using Tall Fescue to understand how plants work with beneficial microbes,Plant Genome Research Program 23rd Annual Awardee Meeting,"Washington, D.C.",
Associate Professor,2022-11-07,"Xie, L., Burridge, J., Kengana, J., Wallace, J. G., Hanlon, M., Lynch, J., Bucksch, A.",Pheotypic Spectrum: a novel framework to study the root architecture diversity of crop roots at the population level,2022 ASA-CSSA-SSSA International Annual Meeting,"Baltimore, Maryland",TRUE
Associate Professor,2022-12-12,"Talamantes, D., & Wallace, J. G.",Tall Fescue Genetics Affecting Epichloe Phenotypes,UGA Plant Center Retreat,"Brasstown Bald, Georgia",
Associate Professor,2022-12-12,"Kirkpatrick, C., & Wallace, J. G.",Vertical transmission of seed-borne endophytes over multiple generations in maize,UGA Plant Center Retreat,"Brasstown Bald, Georgia",
Associate Professor,2023-01-16,"Wilker, J. L., Infante, V., McLimans, C. E., Murray, A., Robbins, F. A., Calderon, C. I., Wallace, J. G., & Ané, J-M.",Aerial Root Formation Persists into the Adult Phase and Is Nitrogen-Level Dependent in Sierra Mixe Corn Landraces,Plant & Animal Genome 30,"San Diego, California",TRUE
Associate Professor,2023-01-16,"Corut, K., &  Wallace, J. G.","kGWASflow: A Modular, Flexible and Reproducible Snakemake Pipeline for k-Mers Based GWAS",Plant & Animal Genome 30,"San Diego, California",TRUE
Associate Professor,2023-06-06,"Punnuri, S. M., Boatwright, L., Coffin, A., Tadesse, H., Knoll, J., Harris, K., and Wallace, J.",Identification of sorghum aphid resistance loci and other related traits using cornerstone genomic resources,Global Sorghum Conference,"Montpelliere, France",TRUE
Associate Professor,2023-08-31,"Venado, R., Pyne, S., Wilker, J., Pankievicz, V., Fernandes, P., Robbins, F., Wolf, E., Vela, S., Laspisa, D., Pereira, W., Dervinis, C., Wallace, J., Vermerris, W., Kirst, M., Roy, S., and Ane, J-M.",Biological Nitrogen Fixation on the Aerial Roots of Maize and Sorghum for Sustainable Agriculture,15th European Nitrogen Fixation Conference,"Naples, Italy",TRUE
Associate Professor,2023-03-16,"Laspisa, D., Phillips, C., Griffis, H., and Wallace, J.",Mapping maize brace root traits associated with nitrogen-fixing bacterial symbiosis,65th Annual Maize Genetics Conference,"Saint Louis, Missouri",TRUE
Associate Professor,2023-08-13,"Corut, K., &  Wallace, J. G.","kGWASflow: A Modular, Flexible and Reproducible Snakemake Pipeline for k-Mers Based GWAS",Plant Biology 2023: ASPB 2023 Worldwide Summit,"Savannah, Georgia",TRUE
Associate Professor,2023-09-07,"Wallace, J. G., & Schardl, C.,",ECA-PGR: Identifying Host Factors that Influence the Association of Tall Fescue (Festuca arundinacea) with Beneficial Epichloë Endophytes,Plant Genome Research Program 26th Annual Awardee Meeting,"Washington, D.C.",
Associate Professor,2023-10-29,"Knoll, J. E., Cuevas, H. E., Shultz, C. R., & Wallace, J. G.",Development and validation of markers for anthracnose resistance in sorghum,2023 ASA-CSSA-SSSA International Annual Meeting,"Saint Louis, Missouri",TRUE
Associate Professor,2023-12-13,"Corut, K., &  Wallace, J. G.","kGWASflow: A Modular, Flexible and Reproducible Snakemake Pipeline for k-Mers Based GWAS",UGA Plant Center Retreat 2023,"Young Harris, Georgia",
Associate Professor,2023-12-13,"Bozic, M, Ignjatovic Micic, D., Nikolic, A., and Wallace, J.",Genes involved in cold response in early developmental stages of maize,UGA Plant Center Retreat 2023,"Young Harris, Georgia",
Associate Professor,2023-12-13,"Talamantes, D., and Wallace, J. G.",Tall Fescue Genetics Changes the Toxicity of Epichloë Endophytes,UGA Plant Center Retreat 2023,"Young Harris, Georgia",
Associate Professor,2023-12-13,"Laspisa, D., Gibson, K., Venado, R., Wilker, J., Infante, V., Calderon, C., Ane, J-M., and Wallace, J.",Genetic Determinants of Aerial Root Formation in Maize: Prospects for Harnessing Biological Nitrogen Fixation,UGA Plant Center Retreat 2023,"Young Harris, Georgia",
Associate Professor,2024-01-10,"Venado, R., Gibson, K., Wilker, J., Wolf, E., Vela, S., Pankievicz, V., Laspissa, D., Infante, V., Calderon, C., Robbins, F., Fernandez-Junior, P., Wallace, J., Vermerris, W., Ane, J-M.",Biological Nitrogen Fixation on the Aerial Roots of Maize and Sorghum for Sustainable Agriculture (poster),Plant & Animal Genome 31,"San Diego, California",TRUE
Associate Professor,2024-01-10,"Talamantes, D., and Wallace, J.",Tall Fescue Genetics Changes the Toxicity of Epichloë Endophytes,Plant & Animal Genome 31,"San Diego, California",TRUE
Associate Professor,2024-01-15,"Venado, R., Gibson, K., Wilker, J., Wolf, E., Vela, S., Pankievicz, V., Laspissa, D., Infante, V., Calderon, C., Robbins, F., Fernandez-Junior, P., Wallace, J., Vermerris, W., Ane, J-M.",Biological Nitrogen Fixation on the Aerial Roots of Maize and Sorghum for Sustainable Agriculture (talk),Plant & Animal Genome 31,"San Diego, California",TRUE
Associate Professor,2024-01-17,"Laspisa, D., Gibson, K., Venado, R., Wilker, J., Infante, V., Calderon, C., Ane, J-M., and Wallace, J.",Genetic Determinants of Aerial Root Formation in Maize: Prospects for Harnessing Biological Nitrogen Fixation (talk),Plant & Animal Genome 31,"San Diego, California",TRUE
Associate Professor,2024-03-01,"Laspisa, D., Gibson, K., Venado, R., Wilker, J., Infante, V., Calderon, C., Ane, J-M., and Wallace, J.",Genetic Determinants of Aerial Root Formation in Maize: Prospects for Harnessing Biological Nitrogen Fixation,66th Annual Maize Genetics Conference,"Raleigh, North Carolina",TRUE
Associate Professor,2024-05-15,"Correa dos Santos, R., Wallace, J.",Correlation analysis of paired transcriptomic and metataxonomic datasets of leaves across diverse maize lines,"UGA Institute of Plant Breeding, Genetics & Genomics annual retreat","Hiawasee, Georgia",
Associate Professor,2024-05-15,"Laspisa, D., Gibson, K., Venado, R., Wilker, J., Infante, V., Calderon, C., Ane, J-M., and Wallace, J.",Genetic Determinants of Aerial Root Formation in Maize: Prospects for Harnessing Biological Nitrogen Fixation,"UGA Institute of Plant Breeding, Genetics & Genomics annual retreat","Hiawasee, Georgia",
Associate Professor,2024-10-31,"Laspisa, D., Gibson, K., Venado, R., Wilker, J., Infante, V., Calderon, C., Ane, J-M., and Wallace, J.",Genetic Determinants of Aerial Root Formation in Maize: Prospects for Harnessing Biological Nitrogen Fixation,UGA Plant Center Retreat 2024,"Pine Mountain, Georgia",
Associate Professor,2024-10-31,"Correa dos Santos, R., Wallace, J.",Correlation analysis of paired transcriptomic and metataxonomic datasets of leaves across diverse maize lines,UGA Plant Center Retreat 2024,"Pine Mountain, Georgia",
Associate Professor,2024-10-31,"Talamantes, D., and Wallace, J.",Tall Fescue Genetics Changes the Toxicity of Epichloë Endophytes,UGA Plant Center Retreat 2024,"Pine Mountain, Georgia",
Associate Professor,2024-11-11,"Harris-Schultz, K., Sapkota, S., Wallace, J., Schwartz, B., Coffin, A., and Zhang, J.",Candidate Genes for Stigma Color Were Identified in a Centipedegrass Population Using a Genome-Wide Association Study,"ASA, CSSA, SSSA International Annual Meeting","San Antonio, Texas",TRUE
Associate Professor,2025-01-10,"Correa dos Santos, R., Wallace, J.",CoNekT Grasses Microbiome enables the network analysis for microbial co-occurence and integration of host RNAseq and microbiome data,Plant & Animal Genome 32,"San Diego, California",TRUE
Associate Professor,2025-01-10,"Talamantes, D., and Wallace, J.",Mapping Tall Fescue genetics to endophyte toxin and biomass production,Plant & Animal Genome 32,"San Diego, California",TRUE
Associate Professor,2025-01-10,"Junior, R., Venado, R., Gibson, K., Laspisa, D., Phillips, C., Wallace, J., de Leon, N., Ane, J-M.",Maize breeding for biological nitrogen fixation on aerial roots,Plant & Animal Genome 32,"San Diego, California",TRUE
